Name,Slug,Homepage,Short Description,Price Text,Pricing,Categories,Verified,Favorite Count,Updated At
SpellPrints,spellprints,https://spellprints.com,"Discover, Use, and Create AI Apps for Everyday Life and Work",,Freemium,"productivity, low-code/no-code, prompts",False,1,2023-07-28
TalkPal,talkpal,http://talkpal.ai/,TalkPal is The Most Efficient Way to Learn a Language Using AI,,Free,"education assistant, life assistant",False,0,2023-07-28
Undetectable AI,undetectable-ai,https://undetectable.ai,We create truly undetectable AI content.,10/mo.,Free Trial,"SEO, paraphraser",False,0,2023-07-28
AskMetric,askmetric,https://www.askmetric.com/,Empowering merchants with all platform data,,Contact for Pricing,"e-commerce, sales",False,0,2023-07-28
Careerflow,careerflow,https://www.careerflow.ai/,AI-powered Job Searching Platform,,Free,human resources,False,0,2023-07-28
MindTrove.AI,mindtroveai,https://www.mindtrove.ai/,Instant Business Insights with A.I,99/mo,Free Trial,"summarizer, finance",False,0,2023-07-28
Parent.wiki,parentwiki,https://parent.wiki/,Search and productivity assistant for parents and families.,[],Free Trial,search engine,False,0,2023-07-28
Lightly IDE,lightly-ide,https://www.lightly-dev.com/,Use AI to code and host with one-click,7/mo.,Free Trial,developer tools,False,0,2023-07-28
Wonder Studio,wonder-studio,https://wonderdynamics.com,Ease your VFX work with AI,,Contact for Pricing,"video editing, 3D",False,0,2023-07-28
Prompt Space,prompt-space,https://promptspace.xyz/,AI Prompts Marketplace,,Paid,prompts,False,0,2023-07-28
Qualifyed.ai,qualifyedai,https://qualifyed.ai,Media buying platform built for sales,,Paid,sales,False,0,2023-07-28
Zoocial,zoocial,https://zoocial.io,Digital marketing automation tool,14.99/mo.,Free Trial,"e-commerce, social media assistant",False,0,2023-07-28
Loopin AI,loopin-ai,https://www.loopinhq.com/,"Turn your meetings into workspaces where your whole team can collaborate and access talking points, notes, and next steps in one place. ",6,Freemium,"summarizer, productivity",False,0,2023-07-28
Abney,abney,https://www.abney.ai/,Produce written assets from your podcast.,39/mo.,Freemium,"summarizer, transcriber",False,0,2023-07-28
Cradl AI,cradl-ai,https://www.cradl.ai/,Build accurate document parsing models using deep learning.,99/mo.,Freemium,developer tools,False,0,2023-07-28
Video2Recipe,video2recipe,https://video2recipe.com,Convert youtube cooking videos into recipes in seconds using AI,9/mo.,Freemium,"summarizer, transcriber, fun tools",False,0,2023-07-28
Minodor,minodor,https://www.minodor.com,Create SEO content 10X faster with Minodor,21.59/mo.,Free Trial,SEO,False,0,2023-07-28
Crystal,crystal,https://www.crystalknows.com/,"Personality-based guidance for every email, call, and meeting",,Contact for Pricing,"sales, life assistant",False,0,2023-07-28
NVIDIA Maxine,nvidia-maxine,https://developer.nvidia.com/maxine,A suite of GPU-accelerated AI SDKs and cloud-native microservices for deploying AI features ,,Paid,,False,0,2023-07-28
ZipChat AI,zipchat-ai,https://zipchat.ai,Create an AI-Powered Chatbot in less than 30 seconds,,Contact for Pricing,"low-code/no-code, startup tools",False,0,2023-07-28
JourneyPlan,journeyplan,https://journeyplan.co,Looking to plan your ultimate vacation trip? JourneyPlan is your perfect companion! Our cutting-edge AI technology creates personalized agenda tailored to your interests and preferences within your timeframe and budget. ,,Free,,False,0,2023-07-28
Momo AI,momo-ai,https://apps.apple.com/app/momo-your-ai-travel-planner/id6446133086,AI travel planner that creates itineraries based on your personality,,Free,"life assistant, fun tools",False,0,2023-07-28
NolanAi,nolanai,https://www.nolanai.app/,AI-driven script writing software. ,,Free,story teller,False,0,2023-07-28
Brand Buzz,brand-buzz,https://brandbuzz.ai,"AI content generator for blogs, articles, websites, social media .",9/mo,Paid,social media assistant,False,0,2023-07-28
Zazzani AI,zazzani-ai,https://www.zazzani.com/,"Speed up your workflow with top-tier software, written content, and art.",,Contact for Pricing,"general writing, image generator, code assistant",False,0,2023-07-28
Compo AI,compo-ai,https://www.compo.ai/,Build with Webflow 100x Faster,,Free,low-code/no-code,False,0,2023-07-28
StudyforCitizenship,studyforcitizenship,https://www.studyforcitizenship.com/,Helps prepare one with US citizenship-related questions with the right answers.,,Free,education assistant,False,0,2023-07-28
Socratic,socraticworks,https://socraticworks.com/,A new kind of work intelligence.,12,Freemium,productivity,False,0,2023-07-28
Essense AI,essense-ai,http://essense.io/,Generate product insights from user feedback with AI,,Free Trial,startup tools,False,0,2023-07-28
HomeByte,homebyte,https://homebyte.com,Find your dream home with the most advanced home search on the planet.,,Free,real estate,False,0,2023-07-28
Prospre,prospre,https://www.prospre.io/,Generate Personalized Meal Plans for Prospre,,Free,life assistant,False,0,2023-07-28
Blockode AI Photo Studio,blockode-ai-photo-studio,https://photostudio.blockode.co/,Generate Photoshoot that perfectly capture your unique style,34.9/mo.,Paid,avatars,False,0,2023-07-28
ChatPDF,chatpdf,https://www.chatpdf.com/,Chat with any PDF using ChatPDF,5/mo,Freemium,"summarizer, research",False,0,2023-07-28
Revalio,revalio,https://revalio.com/,Machine learning powered property valuation and listing composer,,Free,real estate,False,0,2023-07-28
CommentReply.AI,commentreplyai,https://commentreply.ai,Generate thousands of replies to your YouTube comments using Artifial Intelligence.,0,Freemium,social media assistant,False,0,2023-07-28
Brainfish,brainfish,https://brainfi.sh,Answer customer questions instantly with AI,$99/mo,Paid,customer support,False,0,2023-07-28
Bogar.AI,bogarai,https://www.bogar.ai/,Create Better Content 10X Faster,5/mo,Freemium,"general writing, paraphraser",False,0,2023-07-28
Autoblogger.ai,autobloggerai,https://www.autoblogger.ai,AI powered blogging tool,10,Freemium,general writing,False,0,2023-07-28
Wpaibot,wpaibot,https://wpaibot.com,Create content in WordPress quickly and efficiently,12,Paid,"general writing, productivity, copywriting",False,0,2023-07-28
Hushl,hushl,https://hushl.in,Creative platform to help you consistently write better content,,Freemium,"social media assistant, copywriting",False,0,2023-07-28
Phygital+,phygital,https://phygital.plus/,AI Workspace for visual creators,15/mo.,Freemium,"image generator, low-code/no-code",False,0,2023-07-30
Zenen AI Friend Chat Assistant,zenen-ai-friend-chat-assistant,https://zenen.ai/,cutting-edge AI assistant ,,Free,life assistant,False,0,2023-07-28
ChatShape,chatshape,https://www.chatshape.com/,"Build AI Chatbots from your content, remarkably fast",12/mo.,Freemium,"productivity, life assistant",False,0,2023-07-28
Just Prompts,just-prompts,https://just-prompt.vercel.app/,Improve your prompts in seconds,,Free,prompts,False,0,2023-07-28
Cape GPT,cape-gpt,https://chrome.google.com/webstore/detail/cape-gpt/opmheifelnaajjjofhjgicoffamnihbh?hl=en&authuser=0,Give superpowers to ChatGPT,0,Free,productivity,False,0,2023-07-28
Collab.com,collab-nation-ai,https://collab.com/,Contact Center Software meets AI,[],Contact for Pricing,customer support,False,0,2023-07-28
Named by AI,named-by-ai,https://www.namedbyai.com/,Baby name generator,,Free,fun tools,False,0,2023-07-28
Avaturn,avaturn,https://avaturn.me,Turn people into realistic lifelike 3D avatars,,Free,"avatars, 3D",False,1,2023-07-28
Flowrite,flowrite,https://www.flowrite.com,Daily emails and messages generator,13/mo,Free Trial,email assistant,False,0,2023-07-28
Sharly AI,sharly-ai,https://www.sharly.ai/,Understand long documents 10X faster with AI ,50/mo.,Freemium,"summarizer, productivity, research",False,0,2023-07-28
MARA,mara,https://www.mara-solutions.com/,AI Review Reply Assistant ,28/mo.,Freemium,general writing,False,0,2023-07-28
Craftly.ai,craftlyai,https://www.craftly.ai,"Generate Content in seconds, not weeks",29/mo.,Paid,general writing,False,0,2023-07-28
Creasquare,creasquare,https://creasquare.io/,Scale your content effectively using Creasquare,13.9/mo.,Free Trial,social media assistant,False,0,2023-07-28
SciSummary,scisummary,https://scisummary.com/,Summarize scientific articles using AI,,Free,"summarizer, research",False,0,2023-07-28
AutoWrite App,autowrite-app,https://autowrite.app,AI Writer with Human-like SEO,,Freemium,"copywriting, SEO",False,0,2023-07-28
Galeby,galeby,https://galeby.com,Galeby shrinks the time spent doing customer service by 2 using AI,14.95,Paid,"customer support, email assistant, startup tools",False,0,2023-07-28
Geleza,geleza,https://geleza.app,A.I Powered Students Tools & Lessons.,10,Freemium,"general writing, education assistant, fun tools",False,0,2023-07-28
Alphie,alphie,https://www.ojamuai.com/,GPT for zk-rollups,,Paid,"finance, research",False,0,2023-07-28
Swell AI,swell-ai,https://www.swellai.com/,AI writer for podcasters ,29/mo.,Freemium,audio editing,False,0,2023-07-28
Plazmapunk,plazmapunk,https://www.plazmapunk.com/, Experience AI generated videos ,,Free,"video generator, personalized videos",False,0,2023-07-28
Superus,superus,https://superusapp.com/,Turn complex concepts into map-like visuals with AI ,10,Free Trial,presentations,False,0,2023-07-28
OpenRead,openread,https://www.openread.academy/home,AI technology to enhance your research experience.,,Free,"education assistant, research",False,0,2023-07-28
Creatus.AI,creatusai,https://creatus.ai/,Jump-Start Your Social Media With Creatus.AI,,Free,video generator,False,0,2023-07-28
Brand AI Model,brand-ai-model,https://contlo.com/brand-ai-model/,Contextually Generate Marketing Content,,Freemium,"social media assistant, design assistant, email assistant",False,0,2023-07-28
ChatGPT Sidebar,chatgpt-sidebar-with-gpt-4,https://chatgpt-sidebar.com/,AI & you work side by side on any page,,Free,life assistant,False,0,2023-07-28
AI Story Generator,ai-story-generator,https://appintro.io/ai-story-generator-novel-writer?ref=producthunt,Create your own unique stories and novels with ease,12/mo.,Paid,"story teller, art",False,0,2023-07-28
Spacely AI,spacely-ai,https://www.spacely.ai/,Make your dream space a reality.,,Free,real estate,False,0,2023-07-28
SumlyAI,sumlyai,https://www.sumly.ai/,AI-generated podcast summaries,,Free Trial,"summarizer, transcriber",False,0,2023-07-28
Searchable.ai,searchableai,https://www.searchable.ai/,Unify all your work data in one place,3/mo.,Free Trial,"productivity, search engine",False,0,2023-07-28
SketchGPT,sketchgpt,https://www.sketchgpt.xyz/,Generating drawing products using AI for everyone.,,Free Trial,"image generator, design assistant",False,0,2023-07-28
InvokeAI,invokeai,https://github.com/invoke-ai/InvokeAI,AI platform for professional creative visual content.,39/mo,Free,"image generator, art, image editing",False,1,2025-04-17
SchoolAI,schoolai,https://www.schoolai.co/,Save hours writing for schools,Free,Free Trial,education assistant,False,0,2023-07-28
ChatGPT Super,chatgpt-super,https://chrome.google.com/webstore/detail/chatgpt-super-supports-gp/nijlhkhkkhnhidoondiobjdgommomifm?hl=en,Enhances your AI experience by providing a suite of powerful features ,[],Free,productivity,False,0,2023-07-28
Moredeal AI Writer,moredeal-ai-writer,https://www.mdc.ai,WordPress plugin that combines AI and Big Data.,6/mo,Freemium,"e-commerce, copywriting",False,0,2023-07-28
Oxolo.com,oxolocom,https://www.oxolo.com/,Make engaging product videos for your E-commerce store with the help of Artificial Intelligence. Copy your product’s URL and get your product video ready within minutes! Use our Editor to easily make the changes you want. No equipment or editing skills needed. Get your first E-commerce videos for free. ,25/mo.,Freemium,"video generator, sales, video editing",False,0,2023-07-28
Pew AI,pew-ai,https://pew.ai,Instant studio‑quality images with AI,9.9/mo.,Free Trial,image generator,False,0,2023-07-28
ChatMind,chatmind,https://chatmind.tech,Generate and edit mind maps in conversation with AI,,Free,productivity,False,1,2023-07-28
Evoke Music,evoke-music,https://evokemusic.ai/,Royalty-free music library with music made with AI. ,8/mo.,Freemium,music,False,0,2023-07-28
LogMeal,logmeal,https://www.logmeal.es,Shazam for food,0,Free,healthcare,False,0,2023-07-28
Booltool,booltool,https://booltool.boolv.tech/,"Pictures, Videos, and Texts all at your fingertips. ",9.9/mo,Freemium,"social media assistant, copywriting",False,0,2023-07-28
OpenDream,opendream,https://www.opendream.ai/,AI Art Generator,,Free Trial,art,False,0,2023-07-28
Bing Image Creator,bing-image-creator,https://bing.com/create,Create images from words with AI,,Free,image generator,False,0,2023-07-28
Raizer,raizer,https://raizer.app,Fundraising platform for startup founders,99/mo.,Freemium,"finance, startup tools",False,0,2023-07-28
Qlip.ai,qlipai,https://www.qlip.ai,Grow your social media with AI-generated clips.,32.5/mo,Free Trial,"video generator, video editing",False,0,2023-07-28
SpeechGen,speechgen,https://speechgen.io/,The Ultimate Text-to-Speech Solution!,4.99,Freemium,"text to speech, audio editing",False,0,2023-07-28
Adobe Firefly,adobe-firefly,https://www.adobe.com/sensei/generative-ai/firefly.html, Generative AI made for creators.,,Paid,"image generator, video editing, 3D",False,0,2023-07-28
Usemotion,usemotion,https://www.usemotion.com/,AI automated daily planner.,12/mo.,Paid,"productivity, life assistant",False,1,2023-07-28
Metastory AI  ,metastory-ai,https://metastory.ai,Empowering Product Owner with AI,,Freemium,productivity,False,0,2023-07-28
Snowpixel,snowpixel,https://snowpixel.app/,Generative media toolkit,$10,Paid,"image generator, video generator, startup tools",False,0,2023-07-28
MyGPT ,mygpt,https://mygpt.thesamur.ai/,ChatGPT with inbuilt prompt library,,Free,prompts,False,0,2023-07-28
ChatGPT for Youtube,chatgpt-for-youtube,https://chatgpt4youtube.com/,"ChatGPT for Youtube is a free Chrome Extension that provides access to the summary of YouTube videos. Let you quickly get the content of the video, save time and learn quicker.",,Free,"summarizer, transcriber",False,1,2023-07-28
AskNotion,asknotion,https://asknotion.app/,ChatGPT trained on your Notion Pages,9.99/mo.,Free Trial,"general writing, education assistant",False,0,2023-07-28
Autoblogging.ai,autobloggingai,https://autoblogging.ai/, AI to automate your writing. ,1,Paid,"copywriting, SEO",False,0,2023-07-28
Vid2txt,vid2txt,https://vid2txt.com,The easiest app for transcribing video (and audio).,10,Paid,"transcriber, productivity, copywriting",False,0,2023-07-28
Quizbot.ai,quizbotai,https://quizbot.ai/,"AI based question, test generator",9/mo.,Free Trial,education assistant,False,0,2023-07-28
Rask.ai,rask-ai,https://www.rask.ai/,The AI dubbing tool provides opportunity to translate and dub your video.,9/mo,Paid,audio editing,False,0,2023-07-28
Assisterr,assisterr,https://assisterr.xyz/,Web3 analytics powered by natural language,,Contact for Pricing,developer tools,False,0,2023-07-28
Upscale media,upscale-media,https://www.upscale.media/,Powerful AI-driven image upscaling tool for enhancing resolution and quality,29/mo.,Freemium,image editing,False,0,2023-07-28
Maimovie,mai-movie,https://maimovie.com/,AI-powered Movie & TV Show Search,,Freemium,productivity,False,0,2023-07-28
Trellis,trellis,https://www.readtrellis.com/,ChatGPT-powered custom tutor and textbook companion.,,Contact for Pricing,education assistant,False,0,2023-07-28
Exemplary ai,exemplary-ai,https://exemplary.ai/,Transform Your Audio/Video into Content & Insights.,,Contact for Pricing,transcriber,False,0,2023-07-28
Voilà,voila,https://www.getvoila.ai/,AI-powered browser assistant to level up your online productivity.,8,Freemium,search engine,False,0,2023-07-28
Dreamlife AI,dreamlife-ai,https://linktr.ee/dreamlifeai,Camera app that helps you redesign your home with AI ,,Free,image editing,False,0,2023-07-28
ZeroTax Al,zerotax-al,https://zerotax.ai/,One-Stop Shop for AI Assisted Tax Help #TaxGPT,5,Freemium,finance,False,0,2023-07-28
Nutraiplan,nutriplan,https://nutraiplan.com/,Create a customized meal plan in a matter of seconds,,Free,life assistant,False,0,2023-07-28
SecGPT,secgpt,https://alterai.me/,Revolutionizes cybersecurity with AI-driven insights ,,Freemium,developer tools,False,0,2023-07-28
Tiipe,tiipe,https://tiipe.ai/,Get Product Descriptions Ready 10x Faster,29,Free Trial,e-commerce,False,0,2023-07-28
ChatDOC,chatdoc,https://chatdoc.com/,ChatGPT-based file-reading assistant,0,Free,"summarizer, productivity",False,0,2023-07-28
WriteAI.Tech,writeaitech,https://writeai.tech/,"Create unique and engaging content that will increase conversions and drive sales, and generate stunning images that will increase engagement.",0.37/mo.,Free Trial,"general writing, copywriting, paraphraser",False,0,2023-07-28
ChainGPT,chaingpt,https://www.chaingpt.org/,Unleash the power of Blockchain AI,,Free Trial,developer tools,False,0,2023-07-28
Animaker’s Subtitle Generator,animakers-subtitle-generator,https://www.animaker.com/subtitle-generator,World’s fastest AI-Powered Auto Subtitle Generator,10/mo.,Paid,transcriber,False,0,2023-07-28
Praktika ai,praktika-ai,https://praktika.ai/,Immersive language learning app with generative AI Avatars,13/mo.,Paid,"education assistant, avatars",False,0,2023-07-28
Crossplag,crossplags-ai-content-detector,https://crossplag.com/ai-content-detector/,Detect instantly whether a text is AI-generated or human-written.,9.99,Free Trial,education assistant,False,0,2023-07-28
Linksquares,linksquares,https://linksquares.com/,Contract management for humans. Powered by AI.,,Paid,legal assistant,False,0,2023-07-28
Scrip AI,scrip-ai,https://scripai.com/,"30 sec short video AI script for IG Reel, TikTok & YT shorts",,Free,social media assistant,False,0,2023-07-28
Gnod,gnod,https://www.gnod.com,"AI for art, music and travel recommendations. ",,Free,research,False,0,2023-07-28
EasyPrompt,easyprompt,https://www.easyprompt.xyz/,Innovative tool designed to help users interact more effectively.,,Free,prompts,False,0,2023-07-28
Khan Academy Khanmigo,khan-academy-khanmigo,https://www.khanacademy.org/khan-labs,World-class AI for education,20/mo,Paid,education assistant,False,0,2023-07-28
Baked AI,baked-ai,https://www.baked-ai.com,Create AI images and put them on custom products,,Paid,art,False,0,2023-07-28
Systeme,systeme,https://systeme.io,World’s Easiest  All-In-One Marketing  Platform,20/mo.,Freemium,social media assistant,False,0,2023-07-28
Albert,albert,https://albert.ai,Solve your digital advertising challenges using AI,,Contact for Pricing,social media assistant,False,0,2023-07-28
Weblium,weblium,https://weblium.com,Effortless website builder,8.25/mo.,Freemium,low-code/no-code,False,0,2023-07-28
Lovo,lovo,https://lovo.ai,Prime AI Voice Generator and Text to Speech,19/mo.,Freemium,text to speech,False,1,2023-07-28
Finsheet,finsheet,https://finsheet.io/,Finsheet provides stock price in Excel,20/mo.,Freemium,finance,False,0,2023-07-28
Zekai,zekai,https://zekai.co/,"AI for media, retailers and educators.",5/mo.,Freemium,productivity,False,0,2023-07-28
GorillaTerminal AI,gorillaterminal-ai,https://gorillaterminal.com/,AI powered bloomberg terminal alternative ,,Freemium,finance,False,0,2023-07-28
Microsoft 365 Copilot,microsoft-365-copilot,https://news.microsoft.com/reinventing-productivity/,AI Copilot for Microsoft 365,,Paid,"general writing, productivity, email assistant",False,0,2023-07-28
Elai io,elai-io,https://elai.io/,Elai.o - your go-to automated AI video generation platform,29,Freemium,video generator,False,0,2023-07-28
Theneo,theneo,https://www.theneo.io/,Generate Stripe-Like API Docs,120,Freemium,developer tools,False,0,2023-07-28
GoCharlie AI,gocharlie-ai,https://gocharlie.ai/,A generative AI platform for content creators! ,39,Paid,social media assistant,False,0,2023-07-28
HeadlinesAI,headlinesai,https://headlinesai.pro/,"Generate healines for Youtube, Medium, Reddit and IH using AI",7.06/mo.,Freemium,copywriting,False,0,2023-07-28
Upheal,upheal,https://www.upheal.io/,AI assistant for mental health professionals,0,Free,"summarizer, transcriber, healthcare",False,0,2023-07-28
Chibi.ai,chibiai,https://chibi.ai,"AI writing tool for successful bloggers, marketers, and storytellers.",20$/month,Paid,general writing,False,0,2023-07-28
Movmi,movmi,https://movmi.co/,Free human motion capture software for 3D animators.,,Freemium,"video generator, video editing",False,0,2023-07-28
AICheatCheck,aicheatcheck,https://demo.aicheatcheck.com/,World's most accurate AI text detection tool,,Free,education assistant,False,0,2023-07-28
Coloromo AI Art Generator,coloromo-ai-art-generator,https://www.coloromo.com/,Image to Art,,Free,image generator,False,1,2023-07-28
SuperTeam,superteam,https://getsuperteam.com/,AI chats for SMBs,,Contact for Pricing,"e-commerce, sales",False,0,2023-07-28
Warp AI,warp-ai,https://www.warp.dev/,The terminal for the 21st century,,Contact for Pricing,"developer tools, code assistant",False,0,2023-07-28
FlutterFlow AI Gen,flutterflow-ai-gen,https://flutterflow.io/ai-gen,Your intelligent assistant for app creation in Flutter Flow.,,Freemium,code assistant,False,0,2023-07-28
Aiwoo ,aiwoo-powerfull-ai-content-generator-for-woocommerce,https://aiflow.ai/,Generate unique Product Descriptions,,Freemium,e-commerce,False,0,2023-07-28
Dreamlook.ai,dreamlookai,https://dreamlook.ai/,Lightning-fast Dreambooth finetuning,6,Paid,"image generator, developer tools",False,0,2023-07-28
GPTZero,gptzero,https://gptzero.me,Worlds most used AI content detector,,Free,education assistant,False,0,2023-07-28
Charley.ai,charleyai,https://charley.ai,Effortless Writing using the power of AI,7.67/mo,Free Trial,general writing,False,0,2023-07-28
Timely,timely,https://timelyapp.com,The world's best AI-powered automatic time tracker,9/mo,Paid,productivity,False,1,2023-07-28
Epique AI,epique-ai,https://epique.ai,Free AI Tools for Realtors,,Contact for Pricing,real estate,False,0,2023-07-28
Chatfuel AI,chatfuel-ai,https://ai.chatfuel.com/,Take customer communication to the next level,79,Freemium,customer support,False,0,2023-07-28
Dux-soup,dux-soup,https://www.dux-soup.com,Automated LinkedIn lead generation,11.25/mo.,Freemium,"social media assistant, sales",False,0,2023-07-28
Sonix,sonix,https://sonix.ai,Automated transcription in 38+ languages,10,Paid,transcriber,False,0,2023-07-28
Scite_,scite,https://scite.ai,Read what research articles say about each other,15.92/mo,Free Trial,research,False,0,2023-07-28
Analisa.io,analisaio,https://analisa.io,Instagram AI Analytics ,53.42,Freemium,social media assistant,False,0,2023-07-28
Kuki Ai,kuki-ai,https://www.kuki.ai,Ask questions and mimic human conversations,,Contact for Pricing,fun tools,False,0,2023-07-28
Bito,bito,https://bito.co,"Use the same AI as ChatGPT, trained on billions of lines of code and docs",,Free,"low-code/no-code, code assistant",False,1,2023-07-28
Locofy,locofy,https://www.locofy.ai,"Ship products faster with existing design tools, tech stacks & workflows",,Free,"design assistant, developer tools",False,1,2023-07-28
Fluentify,fluentify,http://www.fluentify.io/,Free and open-source  “Copilot for the web”.,,Free,productivity,False,0,2023-07-28
MusicLM,musiclm,https://google-research.github.io/seanet/musiclm/examples/,"Generate high-quality, consistent music with MusicLM",,Free,audio editing,False,1,2023-07-28
Trendspider,trendspider,https://trendspider.com,AI Powered Trading Tool,,Paid,finance,False,0,2023-07-28
Turbohire,turbohire,https://turbohire.co,Complete recruitment automation for everyone,,Free Trial,human resources,False,0,2023-07-28
Phenaki,phenaki,https://phenaki.video,A model for generating videos from text.,,Free,video generator,False,1,2023-07-28
Textify,textify,https://textify.ai/,AI writing tools from a single point of access,9.95/mo.,Freemium,"summarizer, paraphraser",False,0,2023-07-28
Dispute AI,dispute-ai,https://disputeaipro.com/,Artificial Intelligence DIY Credit Repair Software,34.99/mo.,Freemium,finance,False,0,2023-07-28
Listing Copy AI,listing-copy-ai,https://listingcopy.ai,The first ever listing description generator for real estate agents. ,15.83/mo.,Freemium,real estate,False,0,2023-07-28
Meeple,meeple,https://www.meeple.ai/,Close 10x deals using your buyers' words,34.33/mo.,Paid,"summarizer, sales",False,0,2023-07-28
Mails.ai,mailsai,https://mails.ai/,Unlimited Cold Email Outreach at Scale,24,Freemium,"sales, email assistant",False,0,2023-07-28
SmartflowAI,smartflowai,https://smartflowai.com/,Simplify Workflows with Generative AI,,Freemium,startup tools,False,0,2023-07-28
GPT95,gpt95,https://gpt95.com,VSCode extension that uses ChatGPT,2/mo,Free Trial,"developer tools, code assistant",False,0,2023-07-28
Comment analyzer,comment-analyzer-ai,https://www.commentanalyzer.com/,Eazy Sentiment Analysis for Youtube Comment Sections,,Free,social media assistant,False,0,2023-07-28
WebMagic AI,webmagic-ai,https://www.magicapps.ai/webmagic-ai,WebMagic is an AI Article Summarizer. ,,Free Trial,summarizer,False,0,2023-07-28
MarketMuse,marketmuse,https://www.marketmuse.com,"Personalized, objective insights into your content strategy",149/mo,Freemium,social media assistant,False,0,2023-07-28
Helicon,helicon,https://radicalbit.io,Helicon is a low-code platform for data & ML engineering,,Paid,"low-code/no-code, developer tools",False,0,2023-07-28
Writefull ,writefull,https://www.writefull.com,"Writefull’s AI helps you write, paraphrase, copyedit, and more.",2.04/mo.,Contact for Pricing,"general writing, education assistant",False,0,2023-07-28
MailMentor,mailmentor,https://www.mailmentor.io,Drive more revenue with AI generated sales messages,[],Freemium,"sales, email assistant",False,0,2023-07-28
Vizologi,vizologi,https://vizologi.com/,Boost your business strategy,9/mo,Free Trial,startup tools,False,0,2023-07-28
