Name,Slug,Homepage,Short Description,Price Text,Pricing,Categories,Verified,Favorite Count,Updated At
Qatalog,qatalog,https://qatalog.com/,"AI-powered project mgmt/collab tool for people, ops, & knowledge.",9/mo,Free Trial,"productivity, human resources",False,0,2023-07-28
Continual,continual,https://continual.ai/,Operational AI platform for modern data stack,,Free Trial,"code assistant, SQL",False,0,2023-07-28
Kaizan,kaizan,https://kaizan.ai/,Kaizan helps Client Success teams retain and grow revenue.,,Contact for Pricing,customer support,False,0,2023-07-28
Cleanvoice AI,cleanvoice-ai,https://cleanvoice.ai/,"Cleanvoice AI quickly edits your podcast, removing filler sounds and more.",1/hour,Free Trial,audio editing,False,0,2023-07-28
unbounce,unbounce,https://unbounce.com/product/smart-copy//,"Ideate, iterate, write custom copy: web app, desktop app, Chrome extension.",9/mo,"Free Trial, Freemium",copywriting,False,0,2023-07-28
PICLY : AI generated spot the difference,picly,https://www.picly.ai/,AI-generated Spot the Difference Game,,Free,gaming,False,0,2023-07-28
LuciaAI,luciaai,https://luciaai.com/,"AI writing assistant for faster, better writing.",,Freemium,"general writing, paraphraser",False,0,2023-07-28
Editby,editby,https://www.editby.ai/,Use AI to write tweets like famous accounts,,Free Trial,social media assistant,False,0,2023-07-28
Daft Art,daft-art,https://daftart.ai/,Design your own album art with AI-powered generator.,29,Paid,"art, music",False,0,2023-07-28
Pattern Maker AI,pattern-maker-ai,https://patternmakerai.com/,Generate vector patterns w/ AI; browse public patterns.,,Freemium,design assistant,False,0,2023-07-28
texti,texti,https://texti.app/,AI that helps you create better content in your browser!,,Free,"productivity, copywriting",False,0,2023-07-28
AI Room Planner,ai-room-planner,https://airoomplanner.com/,"Get free, unlimited interior design ideas for your room with AI.",,Free Trial,real estate,False,0,2023-07-28
10Web,10web,https://10web.io/,AI-powered WordPress platform for automated website building,,Freemium,low-code/no-code,False,0,2023-07-28
GETitOUT,getitout-ai,https://getitout.io/,Get personas & texts from competitors,,"Free Trial, Paid","sales, email assistant",False,0,2023-07-28
Goodlookup,goodlookup,https://www.goodlookup.com/,Goodlookup uses AI to make spreadsheets easier for everyone.,,Free Trial,spreadsheets,False,0,2023-07-28
Mage,mage,https://www.mage.space/,"Free, fast text-to-image AI with stable diffusion",,Free,"search engine, art",False,0,2023-07-28
Contenda,contenda,https://contenda.co/,"Unified content repository for faster, better repurposing of technical content.",,Contact for Pricing,social media assistant,False,0,2023-07-28
Whisper,whisper,https://github.com/openai/whisper,"Multi-task speech recognition, translation, language ID",,Free,experiments,False,0,2023-07-28
Diffusion Land,diffusion-land,https://diffusion.land/,Use various AI models to generate images,,Free Trial,"image generator, art",False,0,2023-07-28
Writer,writer,https://writer.com/,"AI writing platform for teams to craft clear, consistent content. Try it free!",18/mo,Freemium,SEO,False,0,2023-07-28
Audiolabs,convert-podcast-to-short-form,https://www.audiolabs.io/,"Turn podcast into short-form videos ideal for Tiktok, YT Shorts and Reels",,Freemium,"social media assistant, video generator",False,0,2023-07-28
Tattoos AI,tattoos-ai,https://www.tattoosai.com/,Create the perfect tattoo design with AI-powered personalization.,14.99,Freemium,fun tools,False,0,2023-07-28
Resemble,resemble,https://www.resemble.ai/,AI voice generator with voice cloning for TTS.,0.006/second,Free Trial,text to speech,False,0,2023-07-28
Daydrm.ai,daydrmai,https://www.daydrm.ai/,Concepts on-demand for creatives and agencies,19/mo,Paid,copywriting,False,0,2023-07-28
Casetext,casetext,https://casetext.com/,"Get faster, more accurate legal research at an affordable price",90/mo,Free Trial,"search engine, legal assistant",False,0,2023-07-28
Proposal Genie,proposal-genie,https://www.proposalgenie.ai/,AI-powered tool to create professional Upwork proposals from any device.,,Freemium,"general writing, human resources",False,0,2023-07-28
Sudowrite,sudowrite,https://www.sudowrite.com/,"AI-powered writing help to brainstorm, get feedback, & show, not tell.",10/mo,Free Trial,general writing,False,0,2023-07-28
Spellbook,spellbook,https://www.spellbook.legal/,Draft contracts 3x faster with AI-powered Spellbook and GPT-3.,,Contact for Pricing,legal assistant,False,0,2023-07-28
MindSmith,mindsmith,https://www.mindsmith.ai/,AI-assisted tools for creating & sharing micro-courses.,19/mo,Freemium,education assistant,False,0,2023-07-28
Marketplan,marketplan,https://marketplan.io/,"All-in-one platform to plan, execute, project, and optimize marketing strategy.",9/mo,Freemium,"productivity, sales",False,0,2023-07-28
Spinrewriter,spinrewriter,https://www.spinrewriter.com/,"Create unique, human-quality content quickly for SEO specialists.",47/mo,Free Trial,SEO,False,0,2023-07-28
RocketAI,rocketai,https://rocketai.io/,Create/edit product images & generate design concepts from text prompts.,,Free Trial,"image generator, design assistant, image editing",False,0,2023-07-28
Listnr,listnr,https://www.listnr.tech/?gr_pk=vYP4&gr_uid=aRxw,"Text-to-Voice in seconds, 600+ voices in 80+ languages, export in MP3/WAV.",4/mo,Paid,text to speech,False,0,2023-07-28
Writely,writely,https://www.writelyai.com/,Making writing easier for everyone,25/mo,Free Trial,"summarizer, general writing, paraphraser",False,0,2023-07-28
Pictory,pictory-video-ai,https://pictory.ai?ref=rishabh54,Create engaging videos from scripts & blog posts.,19/mo,Free Trial,video editing,False,0,2024-07-23
Scholarcy,scholarcy,https://www.scholarcy.com/,Save time & get key facts from articles with AI-powered summaries.,7.99/mo,Freemium,"education assistant, research",False,0,2023-07-28
FashionAdvisorAI,fashionadvisorai,https://www.fashionadvisorai.com/,Get fashion advice from AI. Ask questions & dress your best!,,Free,fashion,False,0,2023-07-28
Glean,glean,https://www.glean.com/,Glean insights from all your company's apps quickly and easily.,,Free Trial,"productivity, search engine",False,0,2023-07-28
Industrial Data Labs,industrial-data-labs,https://industrialdatalabs.com/,"A.I. automates manual BOM data entry, freeing up sales teams to focus on selling.",,Paid,sales,False,0,2023-07-28
AIDuh,ai-responder-for-hostaway,https://aiduh.com/,AI-powered Chrome extension cuts writing time by 98%.,,Contact for Pricing,general writing,False,0,2023-07-28
SyntheticAIdata,syntheticaidata,https://syntheticaidata.com/,Create synthetic data for AI models with realistic 3D models,,Contact for Pricing,developer tools,False,0,2023-07-28
Neural.love Art Generator,neurallove-art-generator,https://neural.love/,AI creates art from your words: 5M+ images made.,30/mo,"Freemium, Free",art,False,0,2023-07-28
AI Careers,aicareers,https://aicareers.io/,AI-powered job search to drive innovation through data.,99,Freemium,"human resources, gaming",False,0,2023-07-28
Kafkai,kafkai,https://kafkai.com/,ML-generated articles for marketers & SEOs.,27/mo,Free Trial,SEO,False,0,2023-07-28
Imagine 3D,imagine-3d,https://captures.lumalabs.ai/imagine,"Early 3D prototyping with text, expanding access as quality improves.",,Contact for Pricing,3D,False,0,2023-07-28
Monitaur,monitaur,https://monitaur.ai/,"Audit, track, and record AI for optimal performance and compliance.",,Paid,low-code/no-code,False,0,2023-07-28
Pinegraph,pinegraph,https://pinegraph.com/,Create art with Pinegraph & Pinecasso AI - just describe & it'll do the rest!,,Freemium,design assistant,False,0,2023-07-28
Closers Copy,closers-copy,https://www.closerscopy.com/,Unlock the power of SEO & copywriting to boost sales with irresistible content.,49.99/mo,Paid,"copywriting, SEO",False,0,2023-07-28
Masterpiece Studio ,masterpiece-studio,https://masterpiecestudio.com/,"Create 3D with AI: Generate, Edit, Deploy - no complexity.",,Freemium,3D,False,0,2023-07-28
Waymark,waymark,https://waymark.com/,Create custom video commercials quickly with Waymark's AI video creator.,250/mo,Paid,"video generator, sales",False,0,2023-07-28
Designs AI,designs-ai,https://designs.ai/,"Design with A.I. in 2 mins: logos, videos, banners, mockups.",25/mo,Free Trial,"video generator, design assistant, logo generator",False,0,2023-07-28
Aragon AI,image-generate,https://www.aragon.ai/,Create stunning art 10X faster with AI.,,Paid,avatars,False,0,2023-07-28
Tweet Hunter,tweet-hunter,https://tweethunter.io/,Grow your Twitter audience and monetize it,49/mo.,Free Trial,social media assistant,False,0,2023-07-28
Wombo,wombo,https://www.wombo.art/,Create AI-powered art in seconds with WOMBO Dream.,,Contact for Pricing,art,False,0,2023-07-28
Topaz Video AI,topaz-video-ai,https://www.topazlabs.com/topaz-video-ai,Unlimited access to production-grade neural networks for video optimization.,99,Freemium,video editing,False,0,2023-07-28
NovelAI,novelai,https://novelai.net/,"AI-driven storyteller creates unique stories, romances and more",10/mo,Freemium,story teller,False,0,2023-07-28
GPT-Prompter,gpt-prompter,https://gptprompter.com/,Extension to explain text quickly in Chrome.,,Free,summarizer,False,0,2023-07-28
FakeYou,fakeyou,https://fakeyou.com/,"Create your own voice clone to use in music, videos, twitch rewards and more.",7/mo,Freemium,"text to speech, fun tools",False,0,2023-07-28
growthbar,growthbar,https://www.growthbarseo.com/,"Create SEO-friendly content with AI for blogs, websites, and articles.",29/mo,Paid,SEO,False,0,2023-07-28
PicSo,picso,https://picso.ai/,Create art from text with AI-powered generator.,9.99/mo,Freemium,art,False,0,2023-07-28
Radiant Photo,radiant-photo,https://radiantimaginglabs.com/,"Photos made radiant: perfect color, fast delivery.",,Paid,image editing,False,0,2023-07-28
Reggi,reggi,https://www.yfj.social/reggi-app,Reggi helps you shop stress-free with real-time budget tracking.,,"Free Trial, Freemium",life assistant,False,0,2023-07-28
Delve,delve,https://www.delve.ai/,Automate persona creation for your & competitor biz.,89/mo,Paid,"sales, customer support",False,0,2023-07-28
CTRify,ctrify,https://www.ctrify.com/,AI-Powered SEO Platform to boost SERPs rankings & organic CTR,197,Freemium,SEO,False,0,2023-07-28
LanguageTool,languagetool,https://languagetool.org/,"Corrects spelling, grammar, word choice & style in 30+ languages",1.12/mo,Freemium,"general writing, paraphraser",False,0,2023-07-28
BlogNLP,blognlp,https://www.blognlp.com/,Free AI blog writing tool to create original content quickly & easily.,,Free,SEO,False,0,2023-07-28
Usetwain,usetwain,https://www.usetwain.com/,Improve sales pitch with free Twain tool.,,Free,sales,False,0,2023-07-28
Gemsouls,gemsouls,https://www.mygemsouls.com/,Create virtual humans on a mission to bring joy.,,Freemium,avatars,False,0,2023-07-28
Remove.bg,removebg,https://www.remove.bg/,Remove backgrounds in 5 secs with one click,9/mo,Free Trial,image editing,False,0,2023-07-28
Looria,looria,https://looria.com/,Looria helps you find the best products for your needs and budget.,,Free,"search engine, life assistant",False,0,2023-07-28
Replicastudios,replicastudios,https://www.replicastudios.com/,Create expressive AI voices for your projects with Replica Voice.,24,Free Trial,text to speech,False,0,2023-07-28
The AI Times,the-ai-times,https://www.aitimespage.com/ai,Stay informed with The AI Times. Get issues sent to your inbox.,,Free,resources,False,0,2023-07-28
VEG3,veg3,https://veg3.ai/,Test the world's first vegan AI marketing assistant!,39/mo.,Freemium,copywriting,False,0,2023-07-28
Ready Player Me,ready-player-me,https://readyplayer.me/,"One avatar, many worlds: Cross-game Avatar Platform for the Metaverse.",0.16,Freemium,"avatars, gaming",False,0,2023-07-28
Botowski,botowski,https://www.botowski.com/,AI copywriter to help you write better.,19/mo,Free,copywriting,False,0,2023-07-28
Shumai (Meta),shumai,https://github.com/facebookresearch/shumai,"Fast, network-connected, differentiable tensor library for TypeScript/JS.",10/mo,Free,developer tools,False,0,2023-07-28
Podcastle,podcastle,https://podcastle.ai/,"Studio-quality recording, AI-powered editing and exporting for broadcasts.",3/mo.,Freemium,audio editing,False,0,2023-07-28
Rephrase,rephrase,https://www.rephrase.ai/,Hyper-personalized video creation at scale for engagement & efficiency.,,Paid,personalized videos,False,0,2023-07-28
Debuild,debuild,https://debuild.app/,Create web apps quickly with ease.,,Contact for Pricing,low-code/no-code,False,0,2023-07-28
Teleporthq,teleporthq,https://teleporthq.io/,Collaborative front-end platform for UI development,15/mo,Freemium,low-code/no-code,False,0,2023-07-28
Explore AI,explore,https://exploreai.vercel.app/,AI-powered semantic search engine for fast answers in YouTube videos.,,Free,search engine,False,0,2023-07-28
Moonbeam Exchange,moonbeam,https://moonbeam.ai/,Data science platform providing intelligence & insight from 100+ sources.,,Paid,developer tools,False,0,2023-07-28
Artflow ai,artflow-ai,https://artflow.ai/,Animated Stories with AI-generated assets & original characters,,Free,"video generator, story teller, art",False,1,2023-07-28
WebCopilot,webcopilot,https://www.webcopilot.co/,AI-assisted writing to speed up your Notion pages creation,,Free,general writing,False,0,2023-07-28
Text Generator Plugin,text-generator-plugin,https://text-gen.com/,AI Assistant Tool for knowledge creation & organization in Obsidian.,,Free,"general writing, productivity",False,1,2023-07-28
RunPod,runpod,https://www.runpod.io/,"Rent GPUs from $0.2/hour. Save 80%+ with Jupyter for PyTorch, Tensorflow, etc.",0.2/hour,Paid,developer tools,False,0,2023-07-28
PictoDream,pictodream,https://pictodream.com/,Create custom images with AI using text descriptions.,,Freemium,avatars,False,0,2023-07-28
Compose,compose,https://www.compose.ai/,Automate writing with AI & save 40% of your time.,,Free,general writing,False,0,2023-07-28
Contentfries,contentfries,https://www.contentfries.com/,Create contextual content faster & auto-subtitles in 120+ languages.,9/mo,Free Trial,"transcriber, video editing",False,0,2023-07-28
Free Subtitles AI,free-subtitles-ai,https://freesubtitles.ai/,Create subtitles for movies with free open source app!,,Free,transcriber,False,0,2023-07-28
Go Charlie,go-charlie,https://gocharlie.ai/,Create content with a click.,39/mo.,Freemium,"image generator, copywriting",False,0,2023-07-28
FILM,film,https://replicate.com/google-research/frame-interpolation,Generate frames between images to create animation (Interpolation).,0.0002/second,Free,video generator,False,1,2023-07-28
VWO,vwo,https://vwo.com/testing//,Convert visitors to customers: start experimenting now.,,Free Trial,low-code/no-code,False,0,2023-07-28
Fabled,fabled,https://fabled.ai/,"Create stories with AI, illustrated & enriched with images.",,Contact for Pricing,story teller,False,0,2023-07-28
Neon AI,neon-ai,https://neon.ai/,"Create voice apps: Alexa, Google Home, Siri, Cortana & Mycroft Mark II.",,Free,low-code/no-code,False,0,2023-07-28
Stenography,stenography,https://stenography.dev/,Automated Documentation,20/mo,Paid,"developer tools, code assistant",False,0,2023-07-28
TLDR this,tldr-this,https://tldrthis.com/,Free yourself from info overload: TLDR summarizes text into concise content.,4/mo,Freemium,summarizer,False,0,2023-07-28
Wellsaidlabs,wellsaidlabs,https://wellsaidlabs.com/,Beautiful voices at your fingertips to captivate & reduce costs.,49/mo,Free Trial,text to speech,False,0,2023-07-28
Broadn,broadn,https://www.broadn.io/,Explore new possibilities and expand your knowledge.,,Freemium,startup tools,False,0,2023-07-28
Diagram,diagram,https://diagram.com/,Design smarter with magical new products.,,Free Trial,design assistant,False,0,2023-07-28
HandyPlugins,handyplugins,https://handyplugins.co/handywriter/,AI-powered writing assistant for WordPress,9.99/mo,Free Trial,general writing,False,0,2023-07-28
nichess,nichess,https://nichesss.com/,Get creative content with one click. Our bots do the writing for you.,9/mo,Free Trial,general writing,False,0,2023-07-28
Giftastic.ai,giftasticai,https://giftastic.ai/,"Personalized, unique and thoughtful gift recommendations",,Free,gift ideas,False,0,2023-07-28
Artbreeder,artbreeder,https://www.artbreeder.com/,Create AI art with new possibilities.,,Freemium,art,False,0,2023-07-28
Outplayhq,outplayhq,https://outplayhq.com/,Outplay helps sales teams close more deals & increase revenue.,39/mo,Free Trial,"sales, email assistant",False,0,2023-07-28
Namewizard.ai,namewizardai,https://namewizard.ai/,AI-generated names + domain search for ideas/projects/startups.,,Free,startup tools,False,0,2023-07-28
Digital First AI,digital-first-ai,https://digitalfirst.ai/,AI-powered marketing plans & tactics to switch to autopilot & grow.,59/mo,"Free Trial, Paid",copywriting,False,0,2023-07-28
AIDungeon,aidungeon,https://play.aidungeon.io/,Create AI-generated adventures with infinite possibilities.,0.99,Freemium,gaming,False,0,2023-07-28
Altered,altered,https://www.altered.ai/,Change your voice to any of our custom curated voices for professional performances.,59/mo,Paid,audio editing,False,0,2023-07-28
Omneky,omneky,https://www.omneky.com/,Omnichannel creative orchestration with Omneky,,Paid,sales,False,0,2023-07-28
Dust,dust,https://dust.tt/,Engineer & deploy large language models faster & smarter.,,Free,"low-code/no-code, developer tools",False,1,2023-07-28
Bertha.ai,bertha-ai,https://bertha.ai/,"Get 5,000 Words free forever with Bertha AI.",10/mo,Freemium,copywriting,False,0,2023-07-28
Beb.ai,bebai,https://beb.ai/,Create avatars & content for your brand with Beb.ai!,35,Paid,avatars,False,0,2023-07-28
ML news,ai-news,https://www.machine-learning.news/list/general,Website for AI/ML news in Japanese.,,Free,resources,False,0,2023-07-28
Plask,plask,https://plask.ai/,AI-powered motion capture animation tool for realistic animation.,50/mo,Freemium,3D,False,0,2023-07-28
Clickable,clickable,https://www.clickable.so/,Create stunning ads with no design experience.,,Contact for Pricing,design assistant,False,0,2023-07-28
WhatTheDiff,whatthediff,https://whatthediff.ai/,Code review assistant saves time & provides pull request summaries.,19/mo,Freemium,code assistant,False,0,2023-07-28
FeedHive,feedhive,https://www.feedhive.com/,Manage social media content at scale with FeedHive's AI-powered platform.,19/mo,Free Trial,social media assistant,False,0,2023-07-28
SmartScribe,smartscribe,https://www.smartscribe.co/?via=aitoolhouse.com,"It is an automatic audio transcription tool with a built-in text editor, allowing you to convert your audio/video files automatically into text, and to amend the transcripts until perfection.",7.5/mo,Free Trial,general writing,False,0,2025-05-01
AI Time Machine,ai-time-machine,https://www.myheritage.com/ai-time-machine,Create AI-generated images & time travel with AI Time Machine.,,"Free Trial, Freemium","fun tools, avatars",False,0,2023-07-28
Dreamer,dreamer,https://slashdreamer.com/,Integrate Notion w/ AI to generate images w/ slash command.,0.99/mo,Free Trial,image generator,False,0,2023-07-28
Type Studio,type-studio,https://www.typestudio.co/tool/video-to-text/,Automated video-to-text transcription & quick video editing tools.,12/mo,Freemium,"transcriber, video editing",False,0,2023-07-28
Chai,chai,https://chai.ml/,Build and deploy AI chatbot. Chat with AI.,,Freemium,"fun tools, gaming",False,0,2023-07-28
Writewithlaika,writewithlaika,https://www.writewithlaika.com/,ML for writers to create magical stories!,,Contact for Pricing,general writing,False,0,2023-07-28
Rephrasely,rephrasely,https://rephrasely.com/,Paraphrase tool with 20 modes to help clarify thinking & suit words to audience.,7.99/mo,"Free Trial, Freemium",paraphraser,False,0,2023-07-28
Hairgen AI,hairgen-ai,https://www.hairgen.ai/,See your new hairline with AI before getting a hair transplant.,29,Paid,avatars,False,0,2023-07-28
Subtxt,subtxt,https://subtxt.app/,Intelligent outliner that works with your writer's intuition.,25/mo,Paid,story teller,False,0,2023-07-28
Xokind,xokind,https://www.xokind.com/,"Platform for ML & large AI models via API endpoint for Customer Support, Travel, & Sales.",,Freemium,"sales, customer support",False,0,2023-07-28
Robovision.ai,robovision-ai,https://robovision.ai/product/platform/,Platform for dynamic vision AI that works across the life cycle.,,"Free Trial, Paid",low-code/no-code,False,0,2023-07-28
Scale,scale,https://scale.com/,Better data leads to faster AI value delivery.,,Paid,productivity,False,0,2023-07-28
Luma AI,luma-ai,https://lumalabs.ai/,Unmatched photorealism in lifelike 3D,,Contact for Pricing,"gaming, 3D",False,0,2023-07-28
Dream Up (Deviant Art),dream-up,https://www.dreamup.com/,Create AI art with DreamUp™ and get 5 free prompts,,Free Trial,"search engine, art",False,0,2023-07-28
JobtitlesAI,jobtitlesai,https://jobtitlesai.com/,Accurately classify job titles into field & position.,8/mo,Freemium,human resources,False,0,2023-07-28
Brandmark,brandmark,https://brandmark.io/tools/,Design a professional logo for your business with AI-powered tools.,25,Freemium,logo generator,False,0,2023-07-28
Personal.ai,personal-ai,https://www.personal.ai/,"Generate ideas, recall concepts, catalog ideas and store knowledge.",40/mo,"Free Trial, Paid","productivity, memory",False,0,2023-07-28
Photoroom,photoroom,https://www.photoroom.com/,Create product & portrait pics with your phone.,9.49/mo,Freemium,"design assistant, image editing",False,0,2023-07-28
Resume Worded,resume-worded,https://resumeworded.com/index.php,Get tailored feedback on your resume and LinkedIn profile.,,Freemium,"human resources, life assistant",False,0,2023-07-28
Wordhero,wordhero,https://wordhero.co/,Create original content in seconds with WordHero's AI technology.,49/mo,Paid,"social media assistant, email assistant, SEO",False,0,2023-07-28
DeepL,deepl,https://deepl.com/,3x more accurate machine translation with Advanced AI technology.,,Freemium,productivity,False,0,2023-07-28
Ellie,ellie,https://ellieai.com/,Ellie mimics your writing style to craft personalized replies.,20/mo,Freemium,email assistant,False,0,2023-07-28
Lex,lex,https://lex.page/,Unlock your creativity & unleash your best writing!,,Contact for Pricing,general writing,False,0,2023-07-28
AI Surge Cloud,ai-surge-cloud,https://ai-surge.cloud/,Build ModelOps pipelines quickly and cost-effectively.,,Freemium,low-code/no-code,False,0,2023-07-28
Vana Portrait,vana-portrait,https://portrait.vana.com/,Create a unique self-portrait.,,Paid,"art, avatars",False,0,2023-07-28
Quasi,quasi,https://quasi.market/,"AI creates art, code, music, etc.",5/mo,Free Trial,"general writing, art, music",False,0,2023-07-28
Poly ai,poly-ai,https://poly.ai/,"24/7 automated voice assistance, no agents needed.",,Paid,customer support,False,0,2023-07-28
DreamPic.AI,dreampic-ai,https://dreampic.ai/,Create AI-generated avatars with your photos using DreamBooth.,,Paid,avatars,False,0,2023-07-28
Pitchgrade,pitchgrade,https://pitchgrade.com/,Get feedback on your pitch deck to ease fundraising worries.,,Freemium,"finance, startup tools",False,0,2023-07-28
InstaSalesAI,instasalesai,https://instasalesai.com/,AI tools for Instagram marketing & carousel content creation.,2/mo,Freemium,social media assistant,False,0,2023-07-28
CSM,csm,https://csm.ai/,Translating multi-modal inputs to digital simulators for AI training & AGI.,,Contact for Pricing,"developer tools, 3D",False,0,2023-07-28
Scenario,scenario,https://www.scenario.gg/,"AI-generated game assets for high-quality, style-consistent games.",,Contact for Pricing,"gaming, 3D",False,0,2023-07-28
HireYaY,hireyay,https://hireyay.com/,AI-powered job ads reach millions of job seekers quickly and easily.,49/job,"Free Trial, Paid",human resources,False,0,2023-07-28
Magician (Figma),magician-figma,https://magician.design/,AI-powered Figma plugin for creative design: Magician.,,Contact for Pricing,design assistant,False,1,2023-07-28
BotDistrikt,botdistrikt,https://www.botdistrikt.com/,BotDistrikt provides complete chatbot solutions for businesses.,,Paid,customer support,False,0,2023-07-28
MateAI,mate-ai,https://www.mateai.io/,"Generate, Copy, Design email campaigns in 7 languages.",19/mo,Free Trial,"sales, email assistant",False,1,2023-07-28
Tavus,tavus,https://www.tavus.io/,"AI-generated personalized videos for product, marketing, & sales teams.",,Freemium,personalized videos,False,0,2023-07-28
Scalenut,scalenut,https://www.scalenut.com/,Produce content quickly & easily to reach business goals.,29/mo,Free Trial,SEO,False,0,2023-07-28
CodeSquire,codesquire,https://codesquire.ai/,AI-powered code assistant for data pros to get code completions & suggestions.,,Free Trial,"code assistant, SQL",False,0,2023-07-28
Songtell,songtell,https://songtell.com/,AI-generated song meanings repository with 20000+ meanings & posters.,,Freemium,music,False,0,2023-07-28
Pipl.ai,pipl-ai,https://pipl.ai/,Send cold emails at scale with ease,,Free Trial,"sales, email assistant",False,2,2023-07-28
Vimeo AI,vimeo-ai,https://vimeo.com/campaigns/one-take-video,An integrated video production and editing tool that harnesses the power of artificial intelligence to streamline the video creation process.,20/mo,Paid,"video generator, video editing",False,1,2023-09-07
InterviewGPT,interviewgpt,https://interviewgpt.ai/,Creates a simulation of interview queries for the purpose of job readiness.,,Free,human resources,False,1,2023-09-07
InterviewCoachAI,interviewcoachai,https://interviewcoachai.com/,"Provides customized interview preparation tailored to an individual's specific career, job position, company, and interviewer.",,Free,"education assistant, human resources",False,1,2023-09-07
AutoThread AI,autothread-ai,https://autothreadai.com/,Turning Podcasts and Videos into Captivating Twitter Threads.,9/mo,Freemium,social media assistant,False,0,2023-09-09
