Name,Slug,Homepage,Short Description,Price Text,Pricing,Categories,Verified,Favorite Count,Updated At
Chatbot UI,chatbot-ui,https://www.chatbotui.com/,Chatbot UI is an advanced chatbot kit for OpenAI chat models that seeks to mimic the interface and functionality of ChatGPT.,,Free,productivity,False,0,2023-07-28
Imagetocaption.ai,imagetocaption-ai,https://www.imagetocaption.ai/,Generate relevant captions for images effortlessly with AI.,,Free,general writing,False,0,2023-07-28
Hyrable,hyrable,https://hyrable.webflow.io/,Streamline hiring with AI-powered job description creation and candidate attraction,,Free,general writing,False,0,2023-07-28
Shap-e,shap-e,https://github.com/openai/shap-e,The GitHub repository openai/shap-e is an AI tool that can generate 3D objects based on either text or images.,,Free,3D,False,0,2023-07-28
Cebra,cebra,https://cebra.ai/,Learnable latent embeddings for joint behavioral and neural analysis,,Free,research,False,0,2023-07-28
Jedi GPT,jedi-gpt,https://jedigpt.ai/,AI-powered chatbot with a Jedi mentor theme,,Free,fun tools,False,0,2023-07-28
Acrostic AI,acrostic-ai,https://acrostic.ai/,Generate creative acrostic poems with AI for any input word,,Free,fun tools,False,0,2023-07-28
Menubot,menubot,https://www.menubot.ai/,AI-powered kitchen assistant for personalized meal planning and recipe generation,8/mo,Freemium,life assistant,False,0,2023-07-28
Tabirim,tabirim,https://www.tabirim.co/,AI-powered dream interpretation tool for self-exploration and self-reflection,,Free,life assistant,False,0,2023-07-28
Chadview,chadview,https://chadview.framer.website/,"AI-powered real-time meetings assistant for technical job interviews, technical sales calls, and voice support.",5,Freemium,life assistant,False,0,2023-07-28
System Pro,system-pro,https://pro.system.com/landing,AI-Powered Research Search Tool for Health and Life Sciences,20/mo,Free Trial,research,False,0,2023-07-28
Parrot AI,parrot-ai,https://parrot.ai/,"Video conferences, presentations, and client calls are all captured by Parrot AI, which then converts them into information that can be safely saved, searched for, and shared.",,Free,"summarizer, transcriber",False,0,2023-07-28
IRCopilot,ircopilot,https://www.ircopilot.com/,Interactive assistant for efficient crypto investment research and report generation.,,Free,research,False,0,2023-07-28
Chat AI,chat-ai,https://apps.apple.com/us/app/chat-ai-chatbot-assistant-plus/id1665621226,Intuitive chatbot assistant for iOS devices streamlining daily tasks.,9.99,Free Trial,"general writing, life assistant",False,0,2023-07-28
Supportal,supportal,https://www.suportal.co/,"Create Custom ChatGPT chatbots, trained from any website.",19/mo,Freemium,customer support,False,0,2023-07-28
Chatness,chatness,https://chatness.app/,Self-hosted chatbot platform with ChatGPT and Firebase for easy website integration.,42,Free Trial,customer support,False,0,2023-07-28
Esyblog,esyblog,https://esyblog.com/,AI Powered Programmatic Content Generation for Blogs,99/yr,Free Trial,SEO,False,0,2023-07-28
ReRender AI,rerender-ai,https://rerenderai.com/,"Fast, photorealistic rendering for architectural projects in various design styles.",45/mo,Freemium,"design assistant, 3D",False,0,2023-07-28
Bestflights,bestflights,https://www.bestflights.ai/,Bestflights.ai is an AI-powered tool designed for flight booking and itinerary optimization.,,Free,,False,0,2023-07-28
Lean Canvas,lean-canvas,https://leancanvas.business/,The AI Lean Canvas Generator is an AI-powered tool that helps businesses instantly generate a Lean Canvas based on their company description.,2,Freemium,research,False,0,2023-07-28
Ayanza,ayanza,https://ayanza.com/,"AI powered Notes, Spaces, and Team Management for the top performing teams.",50/mo,Freemium,productivity,False,0,2023-07-28
SEO.APP,seoapp,https://seo.app/,SEO.app is the most powerful advancement in SEO history. The first and only patented SEO assistant for ChatGPT. ,,Contact for Pricing,SEO,False,0,2023-07-28
HiFive,hifive,http://hifivestar.com/,"Enhance reputation, rank & visibility with HiFive review management platform",49/mo.,Paid,"social media assistant, customer support",False,0,2023-07-28
JustComment AI,justcomment-ai,https://www.justcomment.ai/,Personal Comment Assistant to generate powerful and engaging comments.,4/300,Free Trial,social media assistant,False,0,2023-07-28
GPTinf,gptinf,https://www.gptinf.com/,Bypass AI content detectors,12/mo,Free Trial,paraphraser,False,0,2023-07-28
Drumloop AI,drumloop-ai,https://www.drumloopai.com/,Generate Drum Loops with AI Technology,,Free,"audio editing, music",False,1,2023-07-28
Spark Engine,spark-engine,https://www.sparkengine.ai/,Revolutionary generative coding engine transforming the coding landscape.,[],Free,code assistant,False,0,2023-07-28
BookEdit,bookedit,https://bookedit.cloud/,"Comprehensive book modification solution with proofreading, paraphrasing, and translation.",29,Freemium,copywriting,False,0,2023-07-28
Franz AI,franz-ai,https://chrome.google.com/webstore/detail/franz-ai-text-rewriter/lclcncbdhfpolppomniofbkiaaebaefg,A Chrome extension to rewrite text using OpenAI API.,,Free,paraphraser,False,0,2023-07-28
Pestel Analysis,pestel-analysis,https://pestel.dev/,Generate AI-powered PESTEL Analysis for your company based on its description.,2,Freemium,research,False,0,2023-07-28
Value Prop Canvas,value-prop-canvas,https://valueprop.dev/,Generate a value proposition canvas for your business automatically with AI.,2,Freemium,research,False,0,2023-07-28
Seths Chatbot,seths-chatbot,https://seths.blog/bot/,Ask an AI trained on Seth’s writing,,Free,resources,False,0,2023-07-28
Texttomusic,texttomusic,https://www.texttomusic.app/,Text to Music is an AI tool that allows users to generate audio by providing written prompts or descriptions.,9.99,Freemium,music,False,0,2023-07-28
Skoot,skoot,https://skoothere.com/,Plan family itineraries fast with your AI assistant!,,Free,,False,0,2023-07-28
Paperclips,paperclips,https://www.paperclips.app/,Autogenerate high-quality flashcards from your PDFs and save hundreds of hours.,4.99/mo,Paid,education assistant,False,0,2023-07-28
Slack GPT,slack-gpt,https://slack.com/intl/en-in/blog/news/introducing-slack-gpt,"Bringing the power of generative AI in Slack to help you work smarter, learn faster, and communicate better.",2.49/mo,Freemium,"summarizer, general writing",False,0,2023-07-28
AI Jingle Generator,ai-jingle-generator,https://jinglemaker.callmefred.com/,"Instantly generate unique jingles for radio, podcasts, and more.",5,Paid,music,False,0,2023-07-28
Recapext,recapext,https://recapext.xyz/,An Open-source browser extension let you easily summarize any portion of any webpage with ChatGPT,,Free,summarizer,False,0,2023-07-28
KITI AI,kiti-ai,https://kiti.ai/,AI-powered solution that converts online recipes into pre-portioned ingredient kits for convenient cooking.,,Free,fun tools,False,0,2023-07-28
Mailyr,mailyr,https://getmailyr.com/,"Mailyr writes emails for you inside of Gmail, using the power of ChatGPT.",4.90/mo,Free Trial,"general writing, email assistant",False,0,2023-07-28
WebBookingPro,webbookingpro,https://www.webbookingpro.com/,All-in-one solution for managing hotels and vacant rentals,,Contact for Pricing,developer tools,False,0,2023-07-28
Sdf,sdf,https://sdf.com/,"Data infrastructure build system for dependencies at multiple levels, including code, time, and access, with scalability, local execution, data governance, user-friendliness, and cloud deployment.",[],Contact for Pricing,SQL,False,0,2023-10-24
Midjourney for Slack,midjourney-for-slack,https://mjslackbot.com/,Community-created port of Midjourney AI image generation bot for Slack.,,Free Trial,image generator,False,0,2023-07-28
DemandCapture,demandcapture,https://www.demandcapture.com/,Demand generation agency,,Contact for Pricing,sales,False,0,2023-07-28
Webmaxy,webmaxy,https://www.webmaxy.co/,WebMaxy: User Behavior Analytics and Survey Tools,100/mo,Freemium,startup tools,False,0,2023-07-28
PlatePose,platepose,https://platepose.com/,Your AI Food Stylist,11,"Paid, Deals",image editing,False,0,2023-07-28
Coda,coda,https://coda.io/,"Coda, an adaptive and collaborative documentation platform.",12/mo,Freemium,spreadsheets,False,0,2023-07-28
Waitroom,waitroom,https://waitroom.com/,"Waitroom, a video meeting solution designed for efficient teamwork and better meetings.",,Contact for Pricing,productivity,False,0,2023-07-28
Orquesta AI Prompts,orquesta-ai-prompts,https://orquesta.cloud/platform/ai-llm-prompts,Enterprise-ready no-code building block for product teams to infuse products with AI capabilities and prompt management tools.,,Freemium,prompts,False,0,2023-07-28
Leelo,leelo,https://leelo-ai.com/,Effortlessly convert written content into natural-sounding speech with Leelo. ,12/mo,Free Trial,text to speech,False,0,2023-07-28
DreamGF,dreamgf,https://dreamgf.ai/,"AI-driven virtual girlfriend generator with customizable appearance, interests, and interactions.",9.99/mo,Freemium,fun tools,False,0,2023-07-28
Erase It,erase-it,https://erase-it.cloudinary.com/,Remove Unwanted Objects from Your Photos in Seconds. It’s Free!,,Free,image editing,False,0,2023-07-28
ReviewScout AI,reviewscout-all-ai,https://reviewscout.ai/, ReviewScout is a Chrome extension that uses ChatGPT and Keepa analysis to provide valuable insights to Amazon sellers and shoppers.,4.99/mo,Freemium,e-commerce,False,0,2023-07-28
Muzaic Studio,muzaic-studio,https://muzaic.studio/,"AI-generated, copyright-protected music tailored to your videos, created by professional musicians.",6.59/mo,Freemium,music,False,0,2023-07-28
Pineapple Builder,pineapple-builder,https://www.pineapplebuilder.com/,"A Simple AI Website Builder for busy business owners to create branded websites, blogs, portfolios, and newsletters effortlessly.",12/mo,Free Trial,"low-code/no-code, startup tools",False,0,2025-06-06
Buzzy Ai,buzzy-ai,https://www.buzzy.buzz/,"Buzzy, an AI-powered no-code platform for creating stunning apps without coding.",,Contact for Pricing,low-code/no-code,False,0,2023-07-28
Study Ai,study-ai,https://www.studyai.info/,"Study AI, an advanced AI-powered learning and studying tool for customized and detailed answers.",5.59/mo,Freemium,education assistant,False,0,2023-07-28
Hints,hints,https://hints.so/,"Hints, an AI-powered assistant for seamless software automation and productivity management.",7/mo,Paid,productivity,False,0,2023-07-28
Write My Essays AI,write-my-essays-ai,https://writemyessays.ai/,"A series of tools for students' writing purposes, all connected create that perfect essay.",,Free,general writing,False,0,2023-07-28
Plumy,plumy,https://plumy.app/,Plumy generates high-quality content optimized for online sales in a significantly shorter time than manual content creation.,9.90,Freemium,"e-commerce, SEO",False,0,2023-07-28
Longevity Compass AI,longevity-compass-ai,https://spellprints.com/@bonnie/longevity-compass-individual-biohacking-routine,Longevity Compass AI - Individual Biohacking Routine,2,Freemium,healthcare,False,0,2023-07-28
Twissy,twissy,https://twissy.io/,Provides ChatGPT chatbots based on custom data.,7/mo,Freemium,customer support,False,0,2023-07-28
WEVO,wevo,https://wevo.ai/,WEVO is a research and analytics company that uses AI to optimize digital experiences.,,Contact for Pricing,research,False,0,2023-07-28
Ai-Ads,ai-ads,https://ai-ads.net/,Google Ads powered by AI,49/mo,Paid,sales,False,0,2023-07-28
Save ChatGPT,save-chatgpt,https://chrome.google.com/webstore/detail/save-chatgpt/iccmddoieihalmghkeocgmlpilhgnnfn,"Export ChatGPT conversations into PDF, Markdown and TXT files.",,Free,developer tools,False,0,2023-07-28
Trending sounds,trending-sounds,https://trendingsounds.io/,Daily trending sounds delivered to your email.,7/mo,Freemium,music,False,0,2023-07-28
N8n,n8n,https://n8n.io/,Workflow automation for technical professionals.,20/mo,Paid,developer tools,False,0,2023-07-28
Brandbird,brandbird,https://www.brandbird.app/,Image editor for SaaS founders building in public.,10/mo,Freemium,social media assistant,False,0,2023-07-28
Pitch,pitch,https://pitch.com/,"Fast, collaborative presentation software.",8/mo,Freemium,presentations,False,0,2023-07-28
Paddle,paddle,https://www.paddle.com/,"Comprehensive payment, tax, and subscription management for SaaS companies.",[],Contact for Pricing,"e-commerce, finance",False,0,2023-07-28
Lemon Squeezy,lemon-squeezy,https://www.lemonsqueezy.com/,All-in-one platform for managing your SaaS business.,,Paid,"developer tools, finance",False,0,2023-07-28
Slidebean,slidebean,https://slidebean.com/,"Comprehensive toolkit for founders to build, pitch, and grow their startups.",228,Freemium,presentations,False,0,2023-07-28
Make,make,https://www.make.com/en,"A powerful visual platform for building and automating anything across tasks, workflows, apps, and systems.",9/mo,Freemium,"productivity, sales",False,0,2025-06-26
Typli.ai,typliai,https://typli.ai/,AI writing assistant and SEO checker for creating long-form content and marketing copies in minutes.,29/mo,Paid,SEO,False,0,2023-07-28
AIWritingPal,aiwritingpal,https://aiwritingpal.com/,"AIWritingPal: An intuitive, AI-empowered tool, adept at crafting top-notch text and visuals across languages. Your ultimate ally for creativity, amplifying productivity and trimming effort and time.",0,Freemium,"general writing, copywriting",False,0,2023-07-28
There's a Prompt for that,theres-a-prompt-for-that,https://www.theresapromptforthat.xyz/,Generate perfect prompts for popular AI tools with ease.,,Free,prompts,False,0,2023-07-28
Rare genie,rare-genie,https://raregenie.com/,"Generate high-quality, unique content with AI-powered RareGenie.",19.99/mo,Freemium,SEO,False,0,2023-07-28
Caspa AI,caspa-ai,https://www.caspa.ai/,Free AI-powered image creation and editing tool for unique visuals,,Free,image generator,False,1,2023-07-28
EVOLV,evolv,https://goevolv.io/,"EVOLV is an AI-powered New Tab Chrome extension, built for Marketers!",[],Free,SEO,False,0,2023-07-28
Ursule.io,ursule-io,https://ursule.io/,All-in-one French AI productivity solution for businesses and freelancers.,33/mo,Free Trial,"general writing, productivity",False,0,2023-07-28
Checksum,checksum,https://checksum.ai/,Generate and maintain end-to-end tests using AI.,,Contact for Pricing,"developer tools, code assistant",False,0,2023-07-28
BetterPrompt,betterprompt,https://better.avatarprompt.net/,Enhance your Midjourney prompts with AI.,4.9,Freemium,prompts,False,0,2023-07-28
OvalOwl,ovalowl,https://ovalowl.com/home.html,"Custom audio fairy tales for kids with personalized plot, characters, and setting.",9.99/mo,Free Trial,"story teller, fun tools",False,0,2023-07-28
BeforeSunset,beforesunset,https://www.beforesunset.ai/,A mindful productivity app for busy professionals and teams to manage the day,,Contact for Pricing,productivity,False,0,2023-07-28
Quench AI,quench-ai,https://quench.ai/,Quench AI is the world’s first AI learning assistant.,,Contact for Pricing,"education assistant, video generator",False,0,2023-07-28
AgentRunner.ai,agentrunnerai,https://www.agentrunner.ai/,Create autonomous AI agents,0,Free,developer tools,False,1,2023-07-28
Hoku,hoku,https://heyhoku.com/,"Hoku is your AI health coach that syncs with your data, learns your health preferences, and gives you all the guidance and tools to optimise your health.",,Free,healthcare,False,0,2023-07-28
Research Buddy,research-buddy,https://researchbuddy.app/,Academic Literature Review or One-Page Exec Summary on any subject of your choice,,Free,research,False,0,2023-07-28
Wonderplan,wonderplan,https://wonderplan.ai/,"AI-powered travel itinerary planner generates tailored trip recommendations based on your interests, preferences, and budget.",,Free,life assistant,False,0,2023-07-28
Templify.ai,templifyai,https://templify.ai/,AI-powered content generator that helps create unique and engaging content to increase conversions and drive sales.,29.99/mo.,Freemium,"productivity, copywriting, prompts",False,0,2023-07-28
AI Logobrainstorm,ai-logobrainstorm,https://gradientinsight.com/ai-logobrainstorm/,Revolutionize your logo design with AI Logobrainstorm,,Freemium,logo generator,False,0,2023-07-28
ChapterGPT,chaptergpt,https://chapterme.co/,The #1 AI tool for automatically creating timestamp chapters for your videos and podcasts in minutes.,20/mo,Freemium,video editing,False,0,2023-07-28
Slang Thesaurus,slang-thesaurus,https://slangthesaurus.com/translator,SlangThesaurus.com/translator is an AI-powered tool that allows you to translate your text into internet slang with just a few clicks.,[],Free,fun tools,False,0,2023-07-28
Global Predictions Inc,global-predictions-inc,https://www.globalpredictions.com/,Personalized AI-driven investing guide for self-directed investors.,,Free,finance,False,0,2023-07-28
RegEx Generator,regex-generator,https://regex.murfasa.com/,AI-Powered Regular Expression Generator using spoken language,,Free,"general writing, code assistant",False,0,2023-07-28
Araby.ai,arabyai,https://araby.ai/,Comprehensive Arabic AI solutions for various fields and applications,2.99/mo,Free Trial,"general writing, image generator",False,0,2023-07-28
PurpleBuddy-AI,purplebuddy-ai,https://www.purplebuddy-ai.com/,Elevate UX and streamline customer support with PurpleBuddy AI chatbots.,9.99/mo,Paid,"e-commerce, customer support",False,0,2023-07-28
Octoicons,octoicons,https://octoicons.com/,Create Custom SVG Icons with AI.,4,Free Trial,"image generator, design assistant",False,0,2023-07-28
Narraive,narraive,https://narraive.com/,Narraive is a web game about interactive stories generated by AI.,3,Freemium,"story teller, gaming",False,0,2023-07-28
ChattySurvey,chattysurvey,https://chattysurvey.com/,Conversational AI surveys for insightful customer experience feedback.,,Contact for Pricing,customer support,False,0,2023-07-28
Ai voice assistant,ai-voice-assistant,https://serp.ai/tools/ai-voice-assistant/,AI-powered personal voice assistant for seamless interaction with technology.,[],Free,audio editing,False,1,2023-07-28
BgRem,bgrem,https://bgrem.ai/,AI-powered tools for creating and editing images and videos.,5/mo,Free Trial,"image generator, video editing",False,0,2023-07-28
Zencall.ai,zencallai,https://www.zencall.ai/,"Forward your missed calls, or get a number, your AI agent will answer.",29/mo.,Freemium,life assistant,False,0,2023-07-28
SiteExplainer,siteexplainer,https://siteexplainer.com/,SiteExplainer is an AI-powered web app that simplifies and summarizes complicated landing pages and corporate jargon used on websites.,0,Free,summarizer,False,0,2023-07-28
Augmentir,augmentir,https://www.augmentir.com/,Augmentir uses AI to optimize frontline operations in manufacturing organizations.,[],Contact for Pricing,human resources,False,0,2023-07-28
Prompt Paradise,prompt-paradise,https://promptparadiseshop.com/,Prompt Paradise is your one-stop-shop for all your ChatGPT prompt needs.,15,Paid,prompts,False,0,2023-07-28
Vanna AI,vanna-ai,https://vanna.ai/,AI-Generated SQL for your Snowflake Database,,Free,"developer tools, SQL",False,1,2023-07-28
Osher.ai,osherai,https://osher.ai/,"osher.ai lets you build and deploy custom AIs for your business, organization, team or club using your own content.",29/mo,Paid,"sales, customer support",False,0,2023-07-28
Chirper.ai,chirper-ai,https://chirper.ai/,Chirper is an AI-only social network where users can create their own characters (chirpers) with AI and interact with other AI-generated chirpers.,,Free,fun tools,False,0,2023-07-28
ReImagine,reimagine,https://semanticahq.io/reimagine,ReImagine is a Chrome extension powered by AI that creates visually similar images for inspiration and creative use with a click of a button.,,Freemium,image generator,False,0,2023-07-28
Quetab,quetab,https://www.quetab.com/bots/list,Easily create and share AI and ChatGPT bots and apps with Quetab's bot builder,9.99/mo,Freemium,productivity,False,1,2023-07-28
Product Bot AI,product-bot-ai,https://productbot.ai/,AI-Powered application to improve speed and efficiency for product managers.,,Paid,productivity,False,0,2023-07-28
Cosmic Whisper AI,cosmic-whisper-ai,https://cosmicwhisperai.com/,Discover secrets of the universe with Cosmic Whisper AI insights.,,Free,"life assistant, fun tools",False,0,2023-07-28
Doogle AI,doogle-ai,https://app.questmate.com/p/31b674b2-d814-426d-b3e7-8ffec04d9a5e,"AI tool that serves as a one-stop-shop for users seeking to accomplish various tasks, ranging from creating websites and forms to requesting transportation or even scraping websites.",25/mo.,Freemium,life assistant,False,0,2023-07-28
Gifthat,gifthat,https://play.google.com/store/apps/details,AI-powered gift finder app available on Google Play that helps users find the perfect gift for their loved ones in just a few minutes. ,,Free,gift ideas,False,0,2023-07-28
Columns,columns,https://columns.ai/,Columns is an AI-powered data visualization and collaboration platform that allows teams to work together in real-time to create stunning visualizations using natural language inputs and speech.,15/mo.,Freemium,"productivity, developer tools",False,0,2023-07-28
Klynk,klynk,https://klynk.ai/,AI-powered tool for creating customizable and data-driven email campaigns designed for GTM teams,,Freemium,email assistant,False,0,2023-07-28
Alcotravel,alcotravel,https://aicotravel.com/,AI-generated catalog of base itineraries for various cities and regions around the world.,,Free,,False,0,2023-07-28
YaatriAI,yaatriai,https://www.aaspassapp.com/yaatriai,"YaatriAI by AasPass is a travel planning platform that incorporates advanced AI technology to provide personalized recommendations for accommodations, activities, and transportation to make travel planning easier for users.",,Free,,False,0,2023-07-28
SeamlessGPT,seamlessgpt,https://gumroad.com/l/seamlessGPT,"SeamlessGPT seamlessly integrates the power of ChatGPT into any app on your Windows, allowing you to generate text quickly and easily in any context. No need to switch tabs and open OpenAI website every time you want to use ChatGPT.",10.99,Paid,"general writing, spreadsheets",False,0,2023-07-28
Shaping Tomorrow,shaping-tomorrow,https://www.shapingtomorrow.com/,AI-driven horizon scanning and foresight service for strategic intelligence.,,Contact for Pricing,research,False,0,2023-07-28
AI-RnD,ai-rnd,https://www.ai-rnd.com/,Centralized hub for AI research papers and collaboration.,0,Free,research,False,0,2023-07-28
SongR,songr,https://app.songr.ai/,Generate fully-produced custom songs from just a simple text prompt.,,Free,music,False,1,2023-07-28
AiPassportPhotos,aipassportphotos,https://www.aipassportphotos.com/,"Create compliant passport, visa, and ID photos online with AiPassportPhotos",2.99/mo,Paid,image editing,False,0,2023-07-28
FabFab AI,fabfab-ai,https://fabfab.ai/,One-of-a-kind AI-generated wearable art at the intersection of creativity and technology with FabFab.,69,Paid,fashion,False,0,2023-07-28
Xinva,xinva,https://xinva.ai/,"Turn imagination into reality with Xinva, the AI-powered design generator.",39/mo,Deals,design assistant,False,0,2023-07-28
Numerous.ai,numerousai,https://numerous.ai/,AI-powered spreadsheet tool for automation and efficiency.,10/mo,Freemium,"productivity, spreadsheets",False,0,2023-07-28
Tactiq,tactiq,https://tactiq.io/,"AI-powered transcription tool for Zoom, Google Meet, and MS Teams",8/mo,Freemium,"summarizer, transcriber",False,0,2023-07-28
Article Summarizer,article-summarizer,https://summary.arguflow.gg/,Summarize Articles with AI,,Free,summarizer,False,0,2023-07-28
Nero AI Image Upscaler,nero-ai-image-upscaler,https://ai.nero.com/image-upscaler,AI-powered image upscaling tool - enhance photos up to 16x without quality loss.  Image synthesizer x Upscale tool = High-Quality AI Painting.,24.99/yr,Free Trial,image editing,False,0,2023-07-28
StoryScape AI,storyscape-ai,https://storyscapeai.app/,Experience unique AI-crafted stories and make choices that shape your adventure.,,Freemium,story teller,False,0,2023-07-28
Logicballs,logicballs,https://logicballs.com/," AI content generation tool, designed to simplify content creation with an intuitive interface, effortlessly producing high-quality, engaging material.",,Free,copywriting,False,0,2023-07-28
Selfie Vibe,selfie-vibe,https://www.selfievibe.art/,Generate Eye-catching AI Avatars from a Single Photo,,Freemium,avatars,False,0,2023-07-28
Suzan,suzan,https://suzan.ai/,Safe Ai for your team: focused on compliance and social collaboration,5.50/mo.,Paid,"general writing, code assistant",False,0,2023-07-28
LetterMagic,lettermagic,https://lettermagic.io/,Lettermagic easily generates cover letters to save you time to focus on your job search.,7.99/mo,Freemium,"general writing, productivity",False,0,2023-07-28
Goodhues.ai,goodhuesai,https://goodhues.ai/,AI-powered tool and virtual assistant for easy interior design project management.,25/mo,Free Trial,design assistant,False,0,2023-07-28
Holly,holly,https://www.hollyhires.ai/,AI-powered recruitment assistant for a seamless hiring process,,Freemium,human resources,False,0,2023-07-28
Aiart.dev,aiartdev,https://aiart.dev/,AI-generated art platform for creating stunning visuals and music videos.,,Free,art,False,0,2023-07-28
AI Music Generator,ai-music-generator,https://appintro.io/ai-song-generator-music-maker,Music composing tool that creates unique and personalized music.,6.99/wk,Paid,music,False,0,2023-07-28
Namique,nameowl,https://www.namique.xyz/,Namique is a free naming tool that helps users generate unique and creative brand names for their business.,,Free,research,False,0,2023-07-28
AI Vercel Playground,ai-vercel-playground,https://play.vercel.ai/,"AI Playground by Vercel Labs is a web-based tool for comparing, tuning, and playing with the latest AI language models.",,Free,productivity,False,0,2023-07-28
